sp|P26885|FKBP2_HUMAN Peptidyl-prolyl cis-trans isomerase FKBP2 OS=Homo sapiens OX=9606 GN=FKBP2 PE=1 SV=2	0.0075788340607876115	0.005176958966267131	FKBP2	1.0035948405068793
sp|P27144|KAD4_HUMAN Adenylate kinase 4, mitochondrial OS=Homo sapiens OX=9606 GN=AK4 PE=1 SV=1	0.016336597940183915	0.019997723004349988	AK4	1.0139578794660262
sp|P27348|1433T_HUMAN 14-3-3 protein theta OS=Homo sapiens OX=9606 GN=YWHAQ PE=1 SV=1	0.488830038354746	-0.053235399343206646	YWHAQ	0.9637725396234736
sp|P27448|MARK3_HUMAN MAP/microtubule affinity-regulating kinase 3 OS=Homo sapiens OX=9606 GN=MARK3 PE=1 SV=5	0.09011227832489976	-0.06071173639999233	MARK3	0.958790994522261
sp|P27449|VATL_HUMAN V-type proton ATPase 16 kDa proteolipid subunit OS=Homo sapiens OX=9606 GN=ATP6V0C PE=1 SV=1	0.7522838635075069	-0.11793699147068343	ATP6V0C	0.9215044312743623
sp|P27540|ARNT_HUMAN Aryl hydrocarbon receptor nuclear translocator OS=Homo sapiens OX=9606 GN=ARNT PE=1 SV=1	0.2619308294123609	0.14805841017295607	ARNT	1.1080772095088802
sp|P27635|RL10_HUMAN 60S ribosomal protein L10 OS=Homo sapiens OX=9606 GN=RPL10 PE=1 SV=4	0.1563878108763115	-0.034871231430562144	RPL10	0.976118880936123
sp|P27694|RFA1_HUMAN Replication protein A 70 kDa DNA-binding subunit OS=Homo sapiens OX=9606 GN=RPA1 PE=1 SV=2	0.02301161961968493	0.005920340496231469	RPA1	1.004112098895177
sp|P27695|APEX1_HUMAN DNA-(apurinic or apyrimidinic site) lyase OS=Homo sapiens OX=9606 GN=APEX1 PE=1 SV=2	0.06785494599169746	-0.031627585107231404	APEX1	0.978315981711495
sp|P27708|PYR1_HUMAN CAD protein OS=Homo sapiens OX=9606 GN=CAD PE=1 SV=3	2.2917958834285934	-0.23173806619692527	CAD	0.8516083105920503
sp|P27797|CALR_HUMAN Calreticulin OS=Homo sapiens OX=9606 GN=CALR PE=1 SV=1	1.0900032751336886	0.10197525090216719	CALR	1.0732418750208195
sp|P27816|MAP4_HUMAN Microtubule-associated protein 4 OS=Homo sapiens OX=9606 GN=MAP4 PE=1 SV=3	0.40789456850425343	-0.047148260185210455	MAP4	0.9678475598353601
sp|P27824|CALX_HUMAN Calnexin OS=Homo sapiens OX=9606 GN=CANX PE=1 SV=2	0.8399226133039225	0.08181000666640426	CANX	1.0583450087044386
sp|P28062|PSB8_HUMAN Proteasome subunit beta type-8 OS=Homo sapiens OX=9606 GN=PSMB8 PE=1 SV=3	7.801179449692113	3.2055024513195085	PSMB8	9.224702927343888
sp|P28065|PSB9_HUMAN Proteasome subunit beta type-9 OS=Homo sapiens OX=9606 GN=PSMB9 PE=1 SV=2	8.416334823282366	3.296809076066624	PSMB9	9.827395215882971
sp|P28066|PSA5_HUMAN Proteasome subunit alpha type-5 OS=Homo sapiens OX=9606 GN=PSMA5 PE=1 SV=3	1.3713251304515008	-0.3274724760212526	PSMA5	0.7969314424000816
sp|P28070|PSB4_HUMAN Proteasome subunit beta type-4 OS=Homo sapiens OX=9606 GN=PSMB4 PE=1 SV=4	0.5081386217920245	-0.22471861982451147	PSMB4	0.8557619153929114
sp|P28072|PSB6_HUMAN Proteasome subunit beta type-6 OS=Homo sapiens OX=9606 GN=PSMB6 PE=1 SV=4	0.06424987542131029	0.02028268027386332	PSMB6	1.014158173497145
sp|P28074|PSB5_HUMAN Proteasome subunit beta type-5 OS=Homo sapiens OX=9606 GN=PSMB5 PE=1 SV=3	0.05774892354622528	-0.0461992204930084	PSMB5	0.9684844428249924
sp|P28288|ABCD3_HUMAN ATP-binding cassette sub-family D member 3 OS=Homo sapiens OX=9606 GN=ABCD3 PE=1 SV=1	0.004384930654721726	0.003372708590037632	ABCD3	1.0023405181964309
sp|P28331|NDUS1_HUMAN NADH-ubiquinone oxidoreductase 75 kDa subunit, mitochondrial OS=Homo sapiens OX=9606 GN=NDUFS1 PE=1 SV=3	0.08761147871567052	0.018159775998892513	NDUFS1	1.0126669522668197
sp|P28340|DPOD1_HUMAN DNA polymerase delta catalytic subunit OS=Homo sapiens OX=9606 GN=POLD1 PE=1 SV=2	1.0719788240595687	-0.42838953124584767	POLD1	0.7430908287567144
sp|P28347|TEAD1_HUMAN Transcriptional enhancer factor TEF-1 OS=Homo sapiens OX=9606 GN=TEAD1 PE=1 SV=2	0.49246731953449047	0.12128307564017504	TEAD1	1.087701791238842
sp|P28370|SMCA1_HUMAN Probable global transcription activator SNF2L1 OS=Homo sapiens OX=9606 GN=SMARCA1 PE=1 SV=2	0.4983193993338333	-0.12958074304869932	SMARCA1	0.9140970544302002
sp|P28482|MK01_HUMAN Mitogen-activated protein kinase 1 OS=Homo sapiens OX=9606 GN=MAPK1 PE=1 SV=3	0.5649243060047311	-0.21536937217580615	MAPK1	0.8613256069023253
sp|P28799|GRN_HUMAN Progranulin OS=Homo sapiens OX=9606 GN=GRN PE=1 SV=2	0.3862584417000349	0.20282463022853375	GRN	1.150949576774326
sp|P28827|PTPRM_HUMAN Receptor-type tyrosine-protein phosphatase mu OS=Homo sapiens OX=9606 GN=PTPRM PE=1 SV=2	0.49879331776151015	0.24334112307866573	PTPRM	1.1837308800564603
sp|P28838|AMPL_HUMAN Cytosol aminopeptidase OS=Homo sapiens OX=9606 GN=LAP3 PE=1 SV=3	5.227597665003585	1.2256394284032246	LAP3	2.338590772970681
sp|P29083|T2EA_HUMAN General transcription factor IIE subunit 1 OS=Homo sapiens OX=9606 GN=GTF2E1 PE=1 SV=2	0.008987941901513257	-0.010461817791148298	GTF2E1	0.9927746497577052
sp|P29084|T2EB_HUMAN Transcription initiation factor IIE subunit beta OS=Homo sapiens OX=9606 GN=GTF2E2 PE=1 SV=1	0.39949086321751326	-0.21983125732317416	GTF2E2	0.858665863138365
sp|P29144|TPP2_HUMAN Tripeptidyl-peptidase 2 OS=Homo sapiens OX=9606 GN=TPP2 PE=1 SV=4	0.07380972890694365	0.014981582508061916	TPP2	1.0104385471129844
sp|P29218|IMPA1_HUMAN Inositol monophosphatase 1 OS=Homo sapiens OX=9606 GN=IMPA1 PE=1 SV=1	0.12329960644364962	-0.06036156307951479	IMPA1	0.9590237420995567
sp|P29317|EPHA2_HUMAN Ephrin type-A receptor 2 OS=Homo sapiens OX=9606 GN=EPHA2 PE=1 SV=2	1.6170702608160368	0.2856147321802992	EPHA2	1.218929538763047
sp|P29323|EPHB2_HUMAN Ephrin type-B receptor 2 OS=Homo sapiens OX=9606 GN=EPHB2 PE=1 SV=5	5.022822089049934	1.8488350883131839	EPHB2	3.6020921476536585
sp|P29372|3MG_HUMAN DNA-3-methyladenine glycosylase OS=Homo sapiens OX=9606 GN=MPG PE=1 SV=3	0.04723604462180367	-0.012768616636088637	MPG	0.9911885200339221
sp|P29401|TKT_HUMAN Transketolase OS=Homo sapiens OX=9606 GN=TKT PE=1 SV=3	0.7681456561612283	-0.09593539528892259	TKT	0.9356653965261748
sp|P29558|RBMS1_HUMAN RNA-binding motif, single-stranded-interacting protein 1 OS=Homo sapiens OX=9606 GN=RBMS1 PE=1 SV=3	0.5506514208359852	-0.20103282196160666	RBMS1	0.8699275612399048
sp|P29590|PML_HUMAN Protein PML OS=Homo sapiens OX=9606 GN=PML PE=1 SV=3	4.332137795036441	0.6569891911978603	PML	1.5767885346255417
sp|P29692|EF1D_HUMAN Elongation factor 1-delta OS=Homo sapiens OX=9606 GN=EEF1D PE=1 SV=5	0.17666710428807317	-0.03365594984712006	EEF1D	0.9769414796419963
sp|P29728|OAS2_HUMAN 2'-5'-oligoadenylate synthase 2 OS=Homo sapiens OX=9606 GN=OAS2 PE=1 SV=3	8.31097832586129	3.1644052020162525	OAS2	8.965631488776587
sp|P29966|MARCS_HUMAN Myristoylated alanine-rich C-kinase substrate OS=Homo sapiens OX=9606 GN=MARCKS PE=1 SV=4	1.248393426450145	-0.12819751980031646	MARCKS	0.9149738902090898
sp|P29992|GNA11_HUMAN Guanine nucleotide-binding protein subunit alpha-11 OS=Homo sapiens OX=9606 GN=GNA11 PE=1 SV=2	0.5364925426662087	0.1552793516927059	GNA11	1.113637232977564
sp|P30038|AL4A1_HUMAN Delta-1-pyrroline-5-carboxylate dehydrogenase, mitochondrial OS=Homo sapiens OX=9606 GN=ALDH4A1 PE=1 SV=3	0.1847446296892435	-0.11683071930790923	ALDH4A1	0.9222113205526103
sp|P30040|ERP29_HUMAN Endoplasmic reticulum resident protein 29 OS=Homo sapiens OX=9606 GN=ERP29 PE=1 SV=4	0.4185788234778951	0.058631207487106485	ERP29	1.041477164783372
sp|P30041|PRDX6_HUMAN Peroxiredoxin-6 OS=Homo sapiens OX=9606 GN=PRDX6 PE=1 SV=3	1.2729336759111045	-0.18353421378610357	PRDX6	0.8805432584636109
sp|P30044|PRDX5_HUMAN Peroxiredoxin-5, mitochondrial OS=Homo sapiens OX=9606 GN=PRDX5 PE=1 SV=4	2.496895767952758	0.1927959003306221	PRDX5	1.1429766258032932
sp|P30046|DOPD_HUMAN D-dopachrome decarboxylase OS=Homo sapiens OX=9606 GN=DDT PE=1 SV=3	0.3681746395805987	-0.1772648427337699	DDT	0.8843780707297474
sp|P30048|PRDX3_HUMAN Thioredoxin-dependent peroxide reductase, mitochondrial OS=Homo sapiens OX=9606 GN=PRDX3 PE=1 SV=3	0.7342311261370371	0.12765362524409207	PRDX3	1.0925154070227978
sp|P30049|ATPD_HUMAN ATP synthase subunit delta, mitochondrial OS=Homo sapiens OX=9606 GN=ATP5F1D PE=1 SV=2	0.49802791909323496	0.190145814878229	ATP5F1D	1.1408790200207162
sp|P30050|RL12_HUMAN 60S ribosomal protein L12 OS=Homo sapiens OX=9606 GN=RPL12 PE=1 SV=1	0.47018812382559705	0.11002341275816852	RPL12	1.0792457508882873
sp|P30084|ECHM_HUMAN Enoyl-CoA hydratase, mitochondrial OS=Homo sapiens OX=9606 GN=ECHS1 PE=1 SV=4	0.6256734499955031	0.13729022890810494	ECHS1	1.0998373828312742
sp|P30085|KCY_HUMAN UMP-CMP kinase OS=Homo sapiens OX=9606 GN=CMPK1 PE=1 SV=3	0.2586546140185935	-0.0980123626231868	CMPK1	0.9343193405567527
sp|P30086|PEBP1_HUMAN Phosphatidylethanolamine-binding protein 1 OS=Homo sapiens OX=9606 GN=PEBP1 PE=1 SV=3	0.375830285232166	-0.1654470325451809	PEBP1	0.8916521898441876
sp|P30101|PDIA3_HUMAN Protein disulfide-isomerase A3 OS=Homo sapiens OX=9606 GN=PDIA3 PE=1 SV=4	0.19453229923305432	0.02323613032107197	PDIA3	1.0162364599200067
sp|P30153|2AAA_HUMAN Serine/threonine-protein phosphatase 2A 65 kDa regulatory subunit A alpha isoform OS=Homo sapiens OX=9606 GN=PPP2R1A PE=1 SV=4	0.625100084360968	-0.12459196410119178	PPP2R1A	0.9172634351596539
sp|P30154|2AAB_HUMAN Serine/threonine-protein phosphatase 2A 65 kDa regulatory subunit A beta isoform OS=Homo sapiens OX=9606 GN=PPP2R1B PE=1 SV=3	0.22865411834179583	0.06814240685740292	PPP2R1B	1.0483659534720784
sp|P30260|CDC27_HUMAN Cell division cycle protein 27 homolog OS=Homo sapiens OX=9606 GN=CDC27 PE=1 SV=2	0.6457145268613309	0.2269035890966118	CDC27	1.1703204299212917
sp|P30405|PPIF_HUMAN Peptidyl-prolyl cis-trans isomerase F, mitochondrial OS=Homo sapiens OX=9606 GN=PPIF PE=1 SV=1	0.006422323813005984	0.003448493299650579	PPIF	1.0023931724845023
sp|P30414|NKTR_HUMAN NK-tumor recognition protein OS=Homo sapiens OX=9606 GN=NKTR PE=1 SV=2	1.3091442927870722	0.31716857633752005	NKTR	1.2458829862650989
sp|P30419|NMT1_HUMAN Glycylpeptide N-tetradecanoyltransferase 1 OS=Homo sapiens OX=9606 GN=NMT1 PE=1 SV=2	1.6590149883313456	-0.18940067485932166	NMT1	0.8769699569809486
sp|P30498|1B78_HUMAN HLA class I histocompatibility antigen, B-78 alpha chain OS=Homo sapiens OX=9606 GN=HLA-B PE=1 SV=1	7.513531426427178	0.658852941448316	HLA-B	1.5788268302951372
sp|P30508|1C12_HUMAN HLA class I histocompatibility antigen, Cw-12 alpha chain OS=Homo sapiens OX=9606 GN=HLA-C PE=1 SV=2	11.149621548501853	5.257775629965711	HLA-C	38.260282739208535
sp|P30519|HMOX2_HUMAN Heme oxygenase 2 OS=Homo sapiens OX=9606 GN=HMOX2 PE=1 SV=2	0.6572652682605892	-0.1303170444139462	HMOX2	0.9136306501185452
sp|P30520|PURA2_HUMAN Adenylosuccinate synthetase isozyme 2 OS=Homo sapiens OX=9606 GN=ADSS PE=1 SV=3	1.5133188174488232	-0.4145036830851225	ADSS	0.7502775612397045
sp|P30530|UFO_HUMAN Tyrosine-protein kinase receptor UFO OS=Homo sapiens OX=9606 GN=AXL PE=1 SV=4	0.0012056753145546053	0.001284139945675944	AXL	1.000890494237559
sp|P30533|AMRP_HUMAN Alpha-2-macroglobulin receptor-associated protein OS=Homo sapiens OX=9606 GN=LRPAP1 PE=1 SV=1	0.5104335684557426	0.187555971506012	LRPAP1	1.1388328166174209
sp|P30536|TSPO_HUMAN Translocator protein OS=Homo sapiens OX=9606 GN=TSPO PE=1 SV=3	0.03645910916822491	0.0277913148926487	TSPO	1.0194502093757296
sp|P30566|PUR8_HUMAN Adenylosuccinate lyase OS=Homo sapiens OX=9606 GN=ADSL PE=1 SV=2	2.920314827112682	-0.518828664556145	ADSL	0.6979382647621911
sp|P30622|CLIP1_HUMAN CAP-Gly domain-containing linker protein 1 OS=Homo sapiens OX=9606 GN=CLIP1 PE=1 SV=2	0.04857259261726149	-0.038094679579363966	CLIP1	0.9739403497760055
sp|P30626|SORCN_HUMAN Sorcin OS=Homo sapiens OX=9606 GN=SRI PE=1 SV=1	5.014516007079901	-0.826662410668232	SRI	0.5638321268440073
sp|P30740|ILEU_HUMAN Leukocyte elastase inhibitor OS=Homo sapiens OX=9606 GN=SERPINB1 PE=1 SV=1	0.39949086321751326	-0.22083719056627593	SERPINB1	0.8580673586386567
sp|P30825|CTR1_HUMAN High affinity cationic amino acid transporter 1 OS=Homo sapiens OX=9606 GN=SLC7A1 PE=1 SV=1	0.10959342085447858	-0.0741575920065729	SLC7A1	0.9498966157683547
sp|P30837|AL1B1_HUMAN Aldehyde dehydrogenase X, mitochondrial OS=Homo sapiens OX=9606 GN=ALDH1B1 PE=1 SV=3	0.4689317465092962	-0.08215053030772412	ALDH1B1	0.944648471556126
sp|P30876|RPB2_HUMAN DNA-directed RNA polymerase II subunit RPB2 OS=Homo sapiens OX=9606 GN=POLR2B PE=1 SV=1	0.3996060397610842	-0.09061057012676269	POLR2B	0.9391252132570154
sp|P31040|SDHA_HUMAN Succinate dehydrogenase [ubiquinone] flavoprotein subunit, mitochondrial OS=Homo sapiens OX=9606 GN=SDHA PE=1 SV=2	0.014057692794256432	0.008636290499145272	SDHA	1.006004173633484
sp|P31150|GDIA_HUMAN Rab GDP dissociation inhibitor alpha OS=Homo sapiens OX=9606 GN=GDI1 PE=1 SV=2	1.0041869212725392	-0.24126039633674612	GDI1	0.846005884690144
sp|P31153|METK2_HUMAN S-adenosylmethionine synthase isoform type-2 OS=Homo sapiens OX=9606 GN=MAT2A PE=1 SV=1	0.45029222478782693	-0.11880603333015183	MAT2A	0.9209495081950749
sp|P31350|RIR2_HUMAN Ribonucleoside-diphosphate reductase subunit M2 OS=Homo sapiens OX=9606 GN=RRM2 PE=1 SV=1	0.28892021426072534	-0.10939259910872878	RRM2	0.9269782544757932
sp|P31431|SDC4_HUMAN Syndecan-4 OS=Homo sapiens OX=9606 GN=SDC4 PE=1 SV=2	0.0785522620500586	-0.05673204519551567	SDC4	0.9614394819972732
sp|P31689|DNJA1_HUMAN DnaJ homolog subfamily A member 1 OS=Homo sapiens OX=9606 GN=DNAJA1 PE=1 SV=2	0.2976820090934652	0.0716668476201685	DNAJA1	1.0509301964459843
sp|P31930|QCR1_HUMAN Cytochrome b-c1 complex subunit 1, mitochondrial OS=Homo sapiens OX=9606 GN=UQCRC1 PE=1 SV=3	0.6805133026977918	0.11604273941198295	UQCRC1	1.083758072380145
sp|P31937|3HIDH_HUMAN 3-hydroxyisobutyrate dehydrogenase, mitochondrial OS=Homo sapiens OX=9606 GN=HIBADH PE=1 SV=2	0.004159916435240313	0.00484834948961721	HIBADH	1.0033662729927406
sp|P31939|PUR9_HUMAN Bifunctional purine biosynthesis protein PURH OS=Homo sapiens OX=9606 GN=ATIC PE=1 SV=3	1.135003778565391	-0.11350301358988513	ATIC	0.9243409389452844
sp|P31942|HNRH3_HUMAN Heterogeneous nuclear ribonucleoprotein H3 OS=Homo sapiens OX=9606 GN=HNRNPH3 PE=1 SV=2	0.13133058147480173	-0.030879243240616194	HNRNPH3	0.9788235766626078
sp|P31943|HNRH1_HUMAN Heterogeneous nuclear ribonucleoprotein H OS=Homo sapiens OX=9606 GN=HNRNPH1 PE=1 SV=4	0.11348472961555059	-0.02935443707450247	HNRNPH1	0.9798586569757167
sp|P31946|1433B_HUMAN 14-3-3 protein beta/alpha OS=Homo sapiens OX=9606 GN=YWHAB PE=1 SV=3	0.4916981935448643	-0.06911918048383381	YWHAB	0.9532197969137997
sp|P31948|STIP1_HUMAN Stress-induced-phosphoprotein 1 OS=Homo sapiens OX=9606 GN=STIP1 PE=1 SV=1	3.051202988982161	-0.14365003257076392	STIP1	0.9052260250180235
sp|P31949|S10AB_HUMAN Protein S100-A11 OS=Homo sapiens OX=9606 GN=S100A11 PE=1 SV=2	0.023525393700815123	0.014738130618946799	S100A11	1.010268052024349
sp|P32119|PRDX2_HUMAN Peroxiredoxin-2 OS=Homo sapiens OX=9606 GN=PRDX2 PE=1 SV=5	0.05195063071345935	0.01853004934240854	PRDX2	1.0129268905695858
sp|P32322|P5CR1_HUMAN Pyrroline-5-carboxylate reductase 1, mitochondrial OS=Homo sapiens OX=9606 GN=PYCR1 PE=1 SV=2	0.18680658330089528	0.06551215405031596	PYCR1	1.0464563639197773
sp|P32455|GBP1_HUMAN Guanylate-binding protein 1 OS=Homo sapiens OX=9606 GN=GBP1 PE=1 SV=2	10.728789687302289	1.4135922550306004	GBP1	2.6639966256670315
sp|P32780|TF2H1_HUMAN General transcription factor IIH subunit 1 OS=Homo sapiens OX=9606 GN=GTF2H1 PE=1 SV=1	0.144926549189864	0.09408895178880083	GTF2H1	1.0673911478072902
sp|P32969|RL9_HUMAN 60S ribosomal protein L9 OS=Homo sapiens OX=9606 GN=RPL9 PE=1 SV=1	0.31774541972653814	-0.05953804962688114	RPL9	0.959571324492167
sp|P33121|ACSL1_HUMAN Long-chain-fatty-acid--CoA ligase 1 OS=Homo sapiens OX=9606 GN=ACSL1 PE=1 SV=1	0.037347809996420976	0.037468801044591826	ACSL1	1.0263115891820327
sp|P33176|KINH_HUMAN Kinesin-1 heavy chain OS=Homo sapiens OX=9606 GN=KIF5B PE=1 SV=1	4.043950774956691	-0.3003648601185064	KIF5B	0.8120470022670081
sp|P33240|CSTF2_HUMAN Cleavage stimulation factor subunit 2 OS=Homo sapiens OX=9606 GN=CSTF2 PE=1 SV=1	0.2199231497666285	0.07008055425186199	CSTF2	1.0497752971903727
sp|P33316|DUT_HUMAN Deoxyuridine 5'-triphosphate nucleotidohydrolase, mitochondrial OS=Homo sapiens OX=9606 GN=DUT PE=1 SV=4	0.32857790523599434	-0.08110882516084206	DUT	0.9453308060064426
sp|P33527|MRP1_HUMAN Multidrug resistance-associated protein 1 OS=Homo sapiens OX=9606 GN=ABCC1 PE=1 SV=3	0.58514141820426	0.31215737185766723	ABCC1	1.2415629161312993
sp|P33778|H2B1B_HUMAN Histone H2B type 1-B OS=Homo sapiens OX=9606 GN=HIST1H2BB PE=1 SV=2	0.3390449231840704	-0.06847105646227947	HIST1H2BB	0.9536481226683075
sp|P33991|MCM4_HUMAN DNA replication licensing factor MCM4 OS=Homo sapiens OX=9606 GN=MCM4 PE=1 SV=5	0.13218568344162926	-0.04023518740877463	MCM4	0.9724963986231202
sp|P33992|MCM5_HUMAN DNA replication licensing factor MCM5 OS=Homo sapiens OX=9606 GN=MCM5 PE=1 SV=5	0.7499931995542535	-0.11501893536875596	MCM5	0.9233701914184395
sp|P33993|MCM7_HUMAN DNA replication licensing factor MCM7 OS=Homo sapiens OX=9606 GN=MCM7 PE=1 SV=4	0.4419446474576262	-0.08658204340467957	MCM7	0.9417512554825258
sp|P34741|SDC2_HUMAN Syndecan-2 OS=Homo sapiens OX=9606 GN=SDC2 PE=1 SV=2	0.4952242838526154	-0.1861662370534658	SDC2	0.8789382778799013
sp|P34896|GLYC_HUMAN Serine hydroxymethyltransferase, cytosolic OS=Homo sapiens OX=9606 GN=SHMT1 PE=1 SV=1	0.04886309138038552	-0.04369765790100209	SHMT1	0.970165204206815
sp|P34897|GLYM_HUMAN Serine hydroxymethyltransferase, mitochondrial OS=Homo sapiens OX=9606 GN=SHMT2 PE=1 SV=3	0.44491791723863183	0.06789089430900486	SHMT2	1.048183202299887
sp|P34932|HSP74_HUMAN Heat shock 70 kDa protein 4 OS=Homo sapiens OX=9606 GN=HSPA4 PE=1 SV=4	1.416060219604314	-0.1339405572054213	HSPA4	0.9113388293978171
sp|P34949|MPI_HUMAN Mannose-6-phosphate isomerase OS=Homo sapiens OX=9606 GN=MPI PE=1 SV=2	0.7131202913047653	0.14503045323089747	MPI	1.1057539939607641
sp|P35052|GPC1_HUMAN Glypican-1 OS=Homo sapiens OX=9606 GN=GPC1 PE=1 SV=2	0.007793493938046582	-0.003911254383633156	GPC1	0.9972925966964358
sp|P35080|PROF2_HUMAN Profilin-2 OS=Homo sapiens OX=9606 GN=PFN2 PE=1 SV=3	0.12832989273778422	-0.11559421693936606	PFN2	0.9230020665243
sp|P35221|CTNA1_HUMAN Catenin alpha-1 OS=Homo sapiens OX=9606 GN=CTNNA1 PE=1 SV=1	0.009535031250856217	-0.0029366274702555817	CTNNA1	0.9979665552044824
sp|P35222|CTNB1_HUMAN Catenin beta-1 OS=Homo sapiens OX=9606 GN=CTNNB1 PE=1 SV=1	1.7719360700482816	0.20975551407070192	CTNNB1	1.1564921826596424
sp|P35226|BMI1_HUMAN Polycomb complex protein BMI-1 OS=Homo sapiens OX=9606 GN=BMI1 PE=1 SV=2	1.1820561116606323	-0.35899304100962603	BMI1	0.7797086036082262
sp|P35232|PHB_HUMAN Prohibitin OS=Homo sapiens OX=9606 GN=PHB PE=1 SV=1	1.8824982657721432	0.20067917243372912	PHB	1.1492392509602631
sp|P35237|SPB6_HUMAN Serpin B6 OS=Homo sapiens OX=9606 GN=SERPINB6 PE=1 SV=3	2.133443777824312	-0.5969456438019208	SERPINB6	0.6611522122317413
sp|P35240|MERL_HUMAN Merlin OS=Homo sapiens OX=9606 GN=NF2 PE=1 SV=1	1.7826442566798808	0.39784799266219295	NF2	1.3175411237322092
sp|P35241|RADI_HUMAN Radixin OS=Homo sapiens OX=9606 GN=RDX PE=1 SV=1	1.0555915684305976	-0.11212930907178431	RDX	0.9252214965164028
sp|P35244|RFA3_HUMAN Replication protein A 14 kDa subunit OS=Homo sapiens OX=9606 GN=RPA3 PE=1 SV=1	1.072497871360124	0.311219716504603	RPA3	1.2407562453859546
sp|P35249|RFC4_HUMAN Replication factor C subunit 4 OS=Homo sapiens OX=9606 GN=RFC4 PE=1 SV=2	1.3060186292359233	0.22395423465047826	RFC4	1.1679303447954321
sp|P35250|RFC2_HUMAN Replication factor C subunit 2 OS=Homo sapiens OX=9606 GN=RFC2 PE=1 SV=3	0.34025505311925286	0.10759895630040806	RFC2	1.0774335959314274
sp|P35251|RFC1_HUMAN Replication factor C subunit 1 OS=Homo sapiens OX=9606 GN=RFC1 PE=1 SV=4	0.06715855006297362	0.024414350766727544	RFC1	1.0170667390851222
sp|P35268|RL22_HUMAN 60S ribosomal protein L22 OS=Homo sapiens OX=9606 GN=RPL22 PE=1 SV=2	0.10618807460888481	-0.06669068506698628	RPL22	0.9548257075661916
sp|P35269|T2FA_HUMAN General transcription factor IIF subunit 1 OS=Homo sapiens OX=9606 GN=GTF2F1 PE=1 SV=2	0.11415883219305627	-0.12129178469545249	GTF2F1	0.9193640862006514
sp|P35270|SPRE_HUMAN Sepiapterin reductase OS=Homo sapiens OX=9606 GN=SPR PE=1 SV=1	0.0035550185734763407	0.002929425869845681	SPR	1.002032586190768
sp|P35527|K1C9_HUMAN Keratin, type I cytoskeletal 9 OS=Homo sapiens OX=9606 GN=KRT9 PE=1 SV=3	0.5889489481122312	-0.5075037620654237	KRT9	0.7034385172289522
sp|P35555|FBN1_HUMAN Fibrillin-1 OS=Homo sapiens OX=9606 GN=FBN1 PE=1 SV=4	0.4873421519815807	0.202251763796246	FBN1	1.1504926475753305
sp|P35556|FBN2_HUMAN Fibrillin-2 OS=Homo sapiens OX=9606 GN=FBN2 PE=1 SV=3	0.5957632248857685	0.2229498082122341	FBN2	1.167117496748755
sp|P35579|MYH9_HUMAN Myosin-9 OS=Homo sapiens OX=9606 GN=MYH9 PE=1 SV=4	0.7122529595400413	-0.03662337722193465	MYH9	0.9749341091138809
sp|P35580|MYH10_HUMAN Myosin-10 OS=Homo sapiens OX=9606 GN=MYH10 PE=1 SV=3	1.0964799894822779	-0.06725905241270791	MYH10	0.9544496163953826
sp|P35606|COPB2_HUMAN Coatomer subunit beta' OS=Homo sapiens OX=9606 GN=COPB2 PE=1 SV=2	0.4728888776455705	-0.12528323754124412	COPB2	0.91682402977908
sp|P35609|ACTN2_HUMAN Alpha-actinin-2 OS=Homo sapiens OX=9606 GN=ACTN2 PE=1 SV=1	0.3260787663720499	0.04000934860778427	ACTN2	1.0281204888152835
sp|P35610|SOAT1_HUMAN Sterol O-acyltransferase 1 OS=Homo sapiens OX=9606 GN=SOAT1 PE=1 SV=3	0.12600751165104568	0.08339054751275843	SOAT1	1.059505111217903
sp|P35611|ADDA_HUMAN Alpha-adducin OS=Homo sapiens OX=9606 GN=ADD1 PE=1 SV=2	0.006356663195273564	-0.00484882597680053	ADD1	0.9966446916155631
sp|P35613|BASI_HUMAN Basigin OS=Homo sapiens OX=9606 GN=BSG PE=1 SV=2	0.7038304272615118	0.10474467998446224	BSG	1.0753040723790759
sp|P35637|FUS_HUMAN RNA-binding protein FUS OS=Homo sapiens OX=9606 GN=FUS PE=1 SV=1	0.023525393700815123	-0.007124926267032428	FUS	0.9950735523919401
sp|P35658|NU214_HUMAN Nuclear pore complex protein Nup214 OS=Homo sapiens OX=9606 GN=NUP214 PE=1 SV=2	1.0742280933870902	0.196688757017653	NUP214	1.1460649102262725
sp|P35659|DEK_HUMAN Protein DEK OS=Homo sapiens OX=9606 GN=DEK PE=1 SV=1	0.34713952776017964	0.05805649147342762	DEK	1.0410623616665593
sp|P35813|PPM1A_HUMAN Protein phosphatase 1A OS=Homo sapiens OX=9606 GN=PPM1A PE=1 SV=1	0.31019902069275995	0.21371296517713154	PPM1A	1.1596689068664399
sp|P35908|K22E_HUMAN Keratin, type II cytoskeletal 2 epidermal OS=Homo sapiens OX=9606 GN=KRT2 PE=1 SV=2	2.9314820076857493	-0.3023991819861098	KRT2	0.8109027543354476
sp|P35998|PRS7_HUMAN 26S proteasome regulatory subunit 7 OS=Homo sapiens OX=9606 GN=PSMC2 PE=1 SV=3	1.019653825818034	0.12150777843920046	PSMC2	1.0878712162834394
sp|P36404|ARL2_HUMAN ADP-ribosylation factor-like protein 2 OS=Homo sapiens OX=9606 GN=ARL2 PE=1 SV=4	1.6774445118162657	-0.35563876324149063	ARL2	0.7815235415431068
sp|P36405|ARL3_HUMAN ADP-ribosylation factor-like protein 3 OS=Homo sapiens OX=9606 GN=ARL3 PE=1 SV=2	0.3441140569012095	-0.24114994317158767	ARL3	0.8460706576339755
sp|P36507|MP2K2_HUMAN Dual specificity mitogen-activated protein kinase kinase 2 OS=Homo sapiens OX=9606 GN=MAP2K2 PE=1 SV=1	1.4074926628743498	-0.42989458687732235	MAP2K2	0.7423160219958819
sp|P36542|ATPG_HUMAN ATP synthase subunit gamma, mitochondrial OS=Homo sapiens OX=9606 GN=ATP5F1C PE=1 SV=1	0.9451875345981547	0.0953897290809258	ATP5F1C	1.0683539737992742
sp|P36543|VATE1_HUMAN V-type proton ATPase subunit E 1 OS=Homo sapiens OX=9606 GN=ATP6V1E1 PE=1 SV=1	0.8206736649825789	-0.3544085406590435	ATP6V1E1	0.7821902506703219
sp|P36551|HEM6_HUMAN Oxygen-dependent coproporphyrinogen-III oxidase, mitochondrial OS=Homo sapiens OX=9606 GN=CPOX PE=1 SV=3	0.15235685948234193	0.07218528944878272	CPOX	1.0513079228996551
sp|P36578|RL4_HUMAN 60S ribosomal protein L4 OS=Homo sapiens OX=9606 GN=RPL4 PE=1 SV=5	1.2863749507767188	-0.13266654908456887	RPL4	0.9121439655049393
sp|P36639|8ODP_HUMAN 7,8-dihydro-8-oxoguanine triphosphatase OS=Homo sapiens OX=9606 GN=NUDT1 PE=1 SV=3	1.6916165100021616	-0.31452196575076424	NUDT1	0.8041173893681425
sp|P36776|LONM_HUMAN Lon protease homolog, mitochondrial OS=Homo sapiens OX=9606 GN=LONP1 PE=1 SV=2	0.4684582203724756	0.06747564614090562	LONP1	1.0478815491377236
sp|P36871|PGM1_HUMAN Phosphoglucomutase-1 OS=Homo sapiens OX=9606 GN=PGM1 PE=1 SV=3	0.5992658140555727	-0.24938957401405643	PGM1	0.8412522864653459
sp|P36873|PP1G_HUMAN Serine/threonine-protein phosphatase PP1-gamma catalytic subunit OS=Homo sapiens OX=9606 GN=PPP1CC PE=1 SV=1	0.08627411427091797	0.025743178210661855	PPP1CC	1.0180039633535634
sp|P36897|TGFR1_HUMAN TGF-beta receptor type-1 OS=Homo sapiens OX=9606 GN=TGFBR1 PE=1 SV=1	0.8811210515372808	-0.0874874065559732	TGFBR1	0.9411604449624708
sp|P36915|GNL1_HUMAN Guanine nucleotide-binding protein-like 1 OS=Homo sapiens OX=9606 GN=GNL1 PE=1 SV=2	0.17513570031887754	-0.14063654541913329	GNL1	0.9071188283442359
sp|P36954|RPB9_HUMAN DNA-directed RNA polymerase II subunit RPB9 OS=Homo sapiens OX=9606 GN=POLR2I PE=1 SV=1	0.20905498400417377	0.1909909357810371	POLR2I	1.1415475349462192
sp|P36957|ODO2_HUMAN Dihydrolipoyllysine-residue succinyltransferase component of 2-oxoglutarate dehydrogenase complex, mitochondrial OS=Homo sapiens OX=9606 GN=DLST PE=1 SV=4	1.2821712649916814	0.1659306101075645	DLST	1.12188951925452
sp|P37108|SRP14_HUMAN Signal recognition particle 14 kDa protein OS=Homo sapiens OX=9606 GN=SRP14 PE=1 SV=2	0.06715855006297362	0.02634149566245436	SRP14	1.0184262396066148
sp|P37198|NUP62_HUMAN Nuclear pore glycoprotein p62 OS=Homo sapiens OX=9606 GN=NUP62 PE=1 SV=3	0.7650766649893384	0.18177521810353497	NUP62	1.1342787426699965
sp|P37268|FDFT_HUMAN Squalene synthase OS=Homo sapiens OX=9606 GN=FDFT1 PE=1 SV=1	0.17722976725085707	0.06755436669685927	FDFT1	1.0479387282825534
sp|P37802|TAGL2_HUMAN Transgelin-2 OS=Homo sapiens OX=9606 GN=TAGLN2 PE=1 SV=3	1.3213510883232447	-0.15630461158378872	TAGLN2	0.8973205698066469
sp|P37837|TALDO_HUMAN Transaldolase OS=Homo sapiens OX=9606 GN=TALDO1 PE=1 SV=2	0.039515953857602454	-0.02413421444653796	TALDO1	0.9834105827249192
sp|P38117|ETFB_HUMAN Electron transfer flavoprotein subunit beta OS=Homo sapiens OX=9606 GN=ETFB PE=1 SV=3	0.6537635221763988	-0.2641166888019298	ETFB	0.8327084166064797
