sp|Q96P16|RPR1A_HUMAN Regulation of nuclear pre-mRNA domain-containing protein 1A OS=Homo sapiens OX=9606 GN=RPRD1A PE=1 SV=1	2.4020916487347717	-0.640120555475818	RPRD1A	0.6416593277628115
sp|Q96P70|IPO9_HUMAN Importin-9 OS=Homo sapiens OX=9606 GN=IPO9 PE=1 SV=3	0.375830285232166	-0.25596686722262996	IPO9	0.8374257195155633
sp|Q96PC5|MIA2_HUMAN Melanoma inhibitory activity protein 2 OS=Homo sapiens OX=9606 GN=MIA2 PE=1 SV=4	0.4665725590658024	0.19444058266100095	MIA2	1.1442803700638997
sp|Q96PD2|DCBD2_HUMAN Discoidin, CUB and LCCL domain-containing protein 2 OS=Homo sapiens OX=9606 GN=DCBLD2 PE=1 SV=1	0.05973587498753873	0.05183820633760261	DCBLD2	1.036584844805998
sp|Q96PK6|RBM14_HUMAN RNA-binding protein 14 OS=Homo sapiens OX=9606 GN=RBM14 PE=1 SV=2	0.8582981475327234	-0.08935344010461521	RBM14	0.9399439011921104
sp|Q96PU4|UHRF2_HUMAN E3 ubiquitin-protein ligase UHRF2 OS=Homo sapiens OX=9606 GN=UHRF2 PE=1 SV=1	0.4983193993338333	-0.2480185582075477	UHRF2	0.8420521217429779
sp|Q96PU5|NED4L_HUMAN E3 ubiquitin-protein ligase NEDD4-like OS=Homo sapiens OX=9606 GN=NEDD4L PE=1 SV=2	0.7891186405509294	0.3379045499232587	NEDD4L	1.2639194735713977
sp|Q96PU8|QKI_HUMAN Protein quaking OS=Homo sapiens OX=9606 GN=QKI PE=1 SV=1	0.9552490104729137	-0.2896597086366789	QKI	0.8180950015053892
sp|Q96PY5|FMNL2_HUMAN Formin-like protein 2 OS=Homo sapiens OX=9606 GN=FMNL2 PE=1 SV=3	0.29968949660834665	0.11037186852583591	FMNL2	1.079506453819856
sp|Q96Q11|TRNT1_HUMAN CCA tRNA nucleotidyltransferase 1, mitochondrial OS=Homo sapiens OX=9606 GN=TRNT1 PE=1 SV=2	0.4581891873965603	-0.17261870871370238	TRNT1	0.8872307612559084
sp|Q96Q45|TM237_HUMAN Transmembrane protein 237 OS=Homo sapiens OX=9606 GN=TMEM237 PE=1 SV=2	0.26871390252728194	0.14473495728037233	TMEM237	1.1055275342044608
sp|Q96QC0|PP1RA_HUMAN Serine/threonine-protein phosphatase 1 regulatory subunit 10 OS=Homo sapiens OX=9606 GN=PPP1R10 PE=1 SV=1	0.9375558450621431	0.316284921432167	PPP1R10	1.2451201129700897
sp|Q96QD8|S38A2_HUMAN Sodium-coupled neutral amino acid transporter 2 OS=Homo sapiens OX=9606 GN=SLC38A2 PE=1 SV=2	0.25170317791169955	-0.06494078910831773	SLC38A2	0.9559845521752713
sp|Q96QD9|UIF_HUMAN UAP56-interacting factor OS=Homo sapiens OX=9606 GN=FYTTD1 PE=1 SV=3	0.6824904251068522	-0.22147353922243065	FYTTD1	0.8576889629344794
sp|Q96QK1|VPS35_HUMAN Vacuolar protein sorting-associated protein 35 OS=Homo sapiens OX=9606 GN=VPS35 PE=1 SV=2	1.1820561116606323	-0.1878897486685241	VPS35	0.8778888836653789
sp|Q96QR8|PURB_HUMAN Transcriptional activator protein Pur-beta OS=Homo sapiens OX=9606 GN=PURB PE=1 SV=3	0.4969535759970582	0.18249049548965557	PURB	1.1348412489991886
sp|Q96QZ7|MAGI1_HUMAN Membrane-associated guanylate kinase, WW and PDZ domain-containing protein 1 OS=Homo sapiens OX=9606 GN=MAGI1 PE=1 SV=3	0.7149352205915059	-0.329875040624497	MAGI1	0.7956053923216676
sp|Q96R06|SPAG5_HUMAN Sperm-associated antigen 5 OS=Homo sapiens OX=9606 GN=SPAG5 PE=1 SV=2	0.5995369528652283	0.41485455540201954	SPAG5	1.3331642680096674
sp|Q96RF0|SNX18_HUMAN Sorting nexin-18 OS=Homo sapiens OX=9606 GN=SNX18 PE=1 SV=2	0.39191919758452276	-0.26066844846785586	SNX18	0.8347010851182313
sp|Q96RL1|UIMC1_HUMAN BRCA1-A complex subunit RAP80 OS=Homo sapiens OX=9606 GN=UIMC1 PE=1 SV=2	0.13652896282537827	-0.09693552868083599	UIMC1	0.9350169809624429
sp|Q96RL7|VP13A_HUMAN Vacuolar protein sorting-associated protein 13A OS=Homo sapiens OX=9606 GN=VPS13A PE=1 SV=2	0.0007299087082911053	-0.0010156616873122637	VPS13A	0.9992962447170306
sp|Q96RN5|MED15_HUMAN Mediator of RNA polymerase II transcription subunit 15 OS=Homo sapiens OX=9606 GN=MED15 PE=1 SV=2	0.3441140569012095	-0.18262178319750721	MED15	0.8811003330358367
sp|Q96RP9|EFGM_HUMAN Elongation factor G, mitochondrial OS=Homo sapiens OX=9606 GN=GFM1 PE=1 SV=2	0.006242497229793447	0.0020718590763629807	GFM1	1.001437134967422
sp|Q96RQ1|ERGI2_HUMAN Endoplasmic reticulum-Golgi intermediate compartment protein 2 OS=Homo sapiens OX=9606 GN=ERGIC2 PE=1 SV=2	0.7956577941079181	0.22543507364199533	ERGIC2	1.1691297699481817
sp|Q96RQ3|MCCA_HUMAN Methylcrotonoyl-CoA carboxylase subunit alpha, mitochondrial OS=Homo sapiens OX=9606 GN=MCCC1 PE=1 SV=3	0.032917073828424785	0.05601891444900153	MCCC1	1.0395930646676865
sp|Q96RS6|NUDC1_HUMAN NudC domain-containing protein 1 OS=Homo sapiens OX=9606 GN=NUDCD1 PE=1 SV=2	0.5394096055700961	0.15787610888337078	NUDCD1	1.1156435125720234
sp|Q96RT1|ERBIN_HUMAN Erbin OS=Homo sapiens OX=9606 GN=ERBIN PE=1 SV=2	0.2329281258683899	-0.11976616423724334	ERBIN	0.9203368091191433
sp|Q96RU3|FNBP1_HUMAN Formin-binding protein 1 OS=Homo sapiens OX=9606 GN=FNBP1 PE=1 SV=2	0.21923892422937563	-0.11751657077382194	FNBP1	0.9217730091645506
sp|Q96S21|RB40C_HUMAN Ras-related protein Rab-40C OS=Homo sapiens OX=9606 GN=RAB40C PE=1 SV=1	1.456819699793296	0.306569467208222	RAB40C	1.236763345489352
sp|Q96S44|PRPK_HUMAN EKC/KEOPS complex subunit TP53RK OS=Homo sapiens OX=9606 GN=TP53RK PE=1 SV=2	0.10995603386771031	0.03618580989058118	TP53RK	1.0253992942527699
sp|Q96S52|PIGS_HUMAN GPI transamidase component PIG-S OS=Homo sapiens OX=9606 GN=PIGS PE=1 SV=3	0.14707328099467812	0.0916182979914706	PIGS	1.0655647762540346
sp|Q96S55|WRIP1_HUMAN ATPase WRNIP1 OS=Homo sapiens OX=9606 GN=WRNIP1 PE=1 SV=2	1.0188338089531581	-0.249958968081968	WRNIP1	0.8409203316618756
sp|Q96S59|RANB9_HUMAN Ran-binding protein 9 OS=Homo sapiens OX=9606 GN=RANBP9 PE=1 SV=1	2.640465276207274	-0.47584952589070406	RANBP9	0.7190432592310891
sp|Q96S66|CLCC1_HUMAN Chloride channel CLIC-like protein 1 OS=Homo sapiens OX=9606 GN=CLCC1 PE=1 SV=1	0.31378658897607725	0.21544147172374611	CLCC1	1.1610591497955793
sp|Q96S97|MYADM_HUMAN Myeloid-associated differentiation marker OS=Homo sapiens OX=9606 GN=MYADM PE=1 SV=2	0.10959342085447858	0.03491027803545271	MYADM	1.0244931072855596
sp|Q96SB3|NEB2_HUMAN Neurabin-2 OS=Homo sapiens OX=9606 GN=PPP1R9B PE=1 SV=3	0.0740080343674783	0.041689861424565426	PPP1R9B	1.0293187852607861
sp|Q96SB4|SRPK1_HUMAN SRSF protein kinase 1 OS=Homo sapiens OX=9606 GN=SRPK1 PE=1 SV=2	0.47911503304655295	0.12497519544987112	SRPK1	1.0904889835045402
sp|Q96SB8|SMC6_HUMAN Structural maintenance of chromosomes protein 6 OS=Homo sapiens OX=9606 GN=SMC6 PE=1 SV=2	0.08442329971282404	0.0817310903276598	SMC6	1.0582871181408946
sp|Q96SI9|STRBP_HUMAN Spermatid perinuclear RNA-binding protein OS=Homo sapiens OX=9606 GN=STRBP PE=1 SV=1	0.2041213535783714	-0.07810559112671023	STRBP	0.9473007349394982
sp|Q96SK2|TM209_HUMAN Transmembrane protein 209 OS=Homo sapiens OX=9606 GN=TMEM209 PE=1 SV=2	0.6989489632176293	0.298819324149589	TMEM209	1.2301372789157543
sp|Q96SL4|GPX7_HUMAN Glutathione peroxidase 7 OS=Homo sapiens OX=9606 GN=GPX7 PE=1 SV=1	0.1374566553762822	0.04531356152618182	GPX7	1.0319074341165733
sp|Q96ST2|IWS1_HUMAN Protein IWS1 homolog OS=Homo sapiens OX=9606 GN=IWS1 PE=1 SV=2	0.764600257978915	0.28597975708863177	IWS1	1.2192379864416676
sp|Q96ST3|SIN3A_HUMAN Paired amphipathic helix protein Sin3a OS=Homo sapiens OX=9606 GN=SIN3A PE=1 SV=2	0.08082094754031866	0.026218560419736997	SIN3A	1.0183394609463616
sp|Q96SU4|OSBL9_HUMAN Oxysterol-binding protein-related protein 9 OS=Homo sapiens OX=9606 GN=OSBPL9 PE=1 SV=2	0.6690982110717022	-0.2499733582793866	OSBPL9	0.8409119439230311
sp|Q96SY0|INT14_HUMAN Integrator complex subunit 14 OS=Homo sapiens OX=9606 GN=INTS14 PE=1 SV=2	0.36120376548326144	-0.08541447046191286	INTS14	0.942513723164066
sp|Q96SZ5|AEDO_HUMAN 2-aminoethanethiol dioxygenase OS=Homo sapiens OX=9606 GN=ADO PE=1 SV=2	2.2897281318838223	0.25938614055832504	ADO	1.1969692918718093
sp|Q96SZ6|CK5P1_HUMAN CDK5 regulatory subunit-associated protein 1 OS=Homo sapiens OX=9606 GN=CDK5RAP1 PE=1 SV=2	0.008156035014939993	0.008271933965628198	CDK5RAP1	1.0057501366394872
sp|Q96T23|RSF1_HUMAN Remodeling and spacing factor 1 OS=Homo sapiens OX=9606 GN=RSF1 PE=1 SV=2	0.9293130890015165	0.19488899313331665	RSF1	1.1446360842207397
sp|Q96T37|RBM15_HUMAN RNA-binding protein 15 OS=Homo sapiens OX=9606 GN=RBM15 PE=1 SV=2	0.2766821877335427	-0.15014974449945456	RBM15	0.9011569221938471
sp|Q96T51|RUFY1_HUMAN RUN and FYVE domain-containing protein 1 OS=Homo sapiens OX=9606 GN=RUFY1 PE=1 SV=2	0.11934810484220669	0.06540124007907533	RUFY1	1.0463759157541617
sp|Q96T58|MINT_HUMAN Msx2-interacting protein OS=Homo sapiens OX=9606 GN=SPEN PE=1 SV=1	0.635527566336152	0.2702914182244991	SPEN	1.2060514203134163
sp|Q96T76|MMS19_HUMAN MMS19 nucleotide excision repair protein homolog OS=Homo sapiens OX=9606 GN=MMS19 PE=1 SV=2	0.0016148878661718556	-0.0019092622846346163	MMS19	0.9986774755377613
sp|Q96T88|UHRF1_HUMAN E3 ubiquitin-protein ligase UHRF1 OS=Homo sapiens OX=9606 GN=UHRF1 PE=1 SV=1	0.5416488581799084	0.17168251195901918	UHRF1	1.126371325255742
sp|Q96TA1|NIBL1_HUMAN Niban-like protein 1 OS=Homo sapiens OX=9606 GN=FAM129B PE=1 SV=3	1.1256389906867563	-0.1344900330283566	FAM129B	0.9109917960402506
sp|Q96TA2|YMEL1_HUMAN ATP-dependent zinc metalloprotease YME1L1 OS=Homo sapiens OX=9606 GN=YME1L1 PE=1 SV=2	0.03867462813761421	0.03257211973205239	YME1L1	1.0228340685239286
sp|Q96TC7|RMD3_HUMAN Regulator of microtubule dynamics protein 3 OS=Homo sapiens OX=9606 GN=RMDN3 PE=1 SV=2	2.9190399940738314	0.35028957251594484	RMDN3	1.2748164781814093
sp|Q99081|HTF4_HUMAN Transcription factor 12 OS=Homo sapiens OX=9606 GN=TCF12 PE=1 SV=1	0.10559093850481913	-0.08785435447328616	TCF12	0.9409210922659542
sp|Q99417|MYCBP_HUMAN c-Myc-binding protein OS=Homo sapiens OX=9606 GN=MYCBP PE=1 SV=3	0.07967396615544271	0.05306235330752895	MYCBP	1.0374647748442534
sp|Q99426|TBCB_HUMAN Tubulin-folding cofactor B OS=Homo sapiens OX=9606 GN=TBCB PE=1 SV=2	0.43551561572430697	-0.23134114291724192	TBCB	0.8518426426288648
sp|Q99436|PSB7_HUMAN Proteasome subunit beta type-7 OS=Homo sapiens OX=9606 GN=PSMB7 PE=1 SV=1	0.06949086744456202	0.03629997055310852	PSMB7	1.0254804374542703
sp|Q99439|CNN2_HUMAN Calponin-2 OS=Homo sapiens OX=9606 GN=CNN2 PE=1 SV=4	0.2352278986844295	-0.05432831718916997	CNN2	0.9630427073966522
sp|Q99442|SEC62_HUMAN Translocation protein SEC62 OS=Homo sapiens OX=9606 GN=SEC62 PE=1 SV=1	0.08322849197524415	-0.07161683998218857	SEC62	0.9515709669737602
sp|Q99447|PCY2_HUMAN Ethanolamine-phosphate cytidylyltransferase OS=Homo sapiens OX=9606 GN=PCYT2 PE=1 SV=1	0.5096901878384481	-0.2315932544032604	PCYT2	0.8516937958214249
sp|Q99459|CDC5L_HUMAN Cell division cycle 5-like protein OS=Homo sapiens OX=9606 GN=CDC5L PE=1 SV=2	0.2876339877858106	-0.05034668128648323	CDC5L	0.965704241194705
sp|Q99460|PSMD1_HUMAN 26S proteasome non-ATPase regulatory subunit 1 OS=Homo sapiens OX=9606 GN=PSMD1 PE=1 SV=2	0.4454923313976622	-0.1179202665985501	PSMD1	0.9215151141509795
sp|Q99470|SDF2_HUMAN Stromal cell-derived factor 2 OS=Homo sapiens OX=9606 GN=SDF2 PE=1 SV=2	0.10215655870248803	-0.10355941342597219	SDF2	0.9307338523653397
sp|Q99471|PFD5_HUMAN Prefoldin subunit 5 OS=Homo sapiens OX=9606 GN=PFDN5 PE=1 SV=2	1.9407711084520516	-0.5943772022502953	PFDN5	0.6623303151994948
sp|Q99496|RING2_HUMAN E3 ubiquitin-protein ligase RING2 OS=Homo sapiens OX=9606 GN=RNF2 PE=1 SV=1	0.4913496131762837	0.11651016037617193	RNF2	1.0841092576965408
sp|Q99497|PARK7_HUMAN Protein/nucleic acid deglycase DJ-1 OS=Homo sapiens OX=9606 GN=PARK7 PE=1 SV=2	0.21240179586672947	-0.04696003176700536	PARK7	0.9679738431418684
sp|Q99519|NEUR1_HUMAN Sialidase-1 OS=Homo sapiens OX=9606 GN=NEU1 PE=1 SV=1	0.931699955457927	-0.31111845679484446	NEU1	0.806016648366307
sp|Q99523|SORT_HUMAN Sortilin OS=Homo sapiens OX=9606 GN=SORT1 PE=1 SV=3	0.2630848996687032	-0.1540604441114381	SORT1	0.8987174725569865
sp|Q99536|VAT1_HUMAN Synaptic vesicle membrane protein VAT-1 homolog OS=Homo sapiens OX=9606 GN=VAT1 PE=1 SV=2	1.2274369282351556	-0.2105657447866527	VAT1	0.8641982743351279
sp|Q99538|LGMN_HUMAN Legumain OS=Homo sapiens OX=9606 GN=LGMN PE=1 SV=1	1.3360410854128397	0.42214667164338526	LGMN	1.3399198185002106
sp|Q99541|PLIN2_HUMAN Perilipin-2 OS=Homo sapiens OX=9606 GN=PLIN2 PE=1 SV=2	0.42257536751946806	0.2347107558830982	PLIN2	1.176670804316807
sp|Q99543|DNJC2_HUMAN DnaJ homolog subfamily C member 2 OS=Homo sapiens OX=9606 GN=DNAJC2 PE=1 SV=4	0.9694885964565851	-0.3089691945643805	DNAJC2	0.8072183106118491
sp|Q99547|MPH6_HUMAN M-phase phosphoprotein 6 OS=Homo sapiens OX=9606 GN=MPHOSPH6 PE=1 SV=2	0.5211552942324963	0.1957339169208775	MPHOSPH6	1.1453066441704276
sp|Q99549|MPP8_HUMAN M-phase phosphoprotein 8 OS=Homo sapiens OX=9606 GN=MPHOSPH8 PE=1 SV=2	1.7684429747831405	0.5566245364018911	MPHOSPH8	1.4708239118613902
sp|Q99567|NUP88_HUMAN Nuclear pore complex protein Nup88 OS=Homo sapiens OX=9606 GN=NUP88 PE=1 SV=2	0.02301161961968493	0.01339108516255292	NUP88	1.0093252042135394
sp|Q99569|PKP4_HUMAN Plakophilin-4 OS=Homo sapiens OX=9606 GN=PKP4 PE=1 SV=2	0.433096274371814	-0.23279388591986594	PKP4	0.8509852988737573
sp|Q99570|PI3R4_HUMAN Phosphoinositide 3-kinase regulatory subunit 4 OS=Homo sapiens OX=9606 GN=PIK3R4 PE=1 SV=3	0.529553032652799	-0.3160594560671077	PIK3R4	0.8032608922434076
sp|Q99575|POP1_HUMAN Ribonucleases P/MRP protein subunit POP1 OS=Homo sapiens OX=9606 GN=POP1 PE=1 SV=2	0.039515953857602454	-0.0521434566632899	POP1	0.9645022730065957
sp|Q99584|S10AD_HUMAN Protein S100-A13 OS=Homo sapiens OX=9606 GN=S100A13 PE=1 SV=1	0.3256664602730884	-0.2033425695875215	S100A13	0.8685359258143742
sp|Q99590|SCAFB_HUMAN Protein SCAF11 OS=Homo sapiens OX=9606 GN=SCAF11 PE=1 SV=2	0.13255660596668953	0.10746883480816816	SCAF11	1.0773364229731248
sp|Q99598|TSNAX_HUMAN Translin-associated protein X OS=Homo sapiens OX=9606 GN=TSNAX PE=1 SV=1	0.015502390728584196	0.01472137031049603	TSNAX	1.0102563154443127
sp|Q99613|EIF3C_HUMAN Eukaryotic translation initiation factor 3 subunit C OS=Homo sapiens OX=9606 GN=EIF3C PE=1 SV=1	1.2826049238452832	-0.21957079151058612	EIF3C	0.858820901650284
sp|Q99614|TTC1_HUMAN Tetratricopeptide repeat protein 1 OS=Homo sapiens OX=9606 GN=TTC1 PE=1 SV=1	0.01604468331011743	-0.0075936134483061135	TTC1	0.9947503361491039
sp|Q99615|DNJC7_HUMAN DnaJ homolog subfamily C member 7 OS=Homo sapiens OX=9606 GN=DNAJC7 PE=1 SV=2	1.496590532006043	-0.300788381435634	DNAJC7	0.8118086506193956
sp|Q99618|CDCA3_HUMAN Cell division cycle-associated protein 3 OS=Homo sapiens OX=9606 GN=CDCA3 PE=1 SV=1	0.7648862170989938	-0.21865993744052764	CDCA3	0.8593632945232936
sp|Q99622|C10_HUMAN Protein C10 OS=Homo sapiens OX=9606 GN=C12orf57 PE=1 SV=1	0.0531765064505912	0.026603074864147827	C12orf57	1.0186109101485141
sp|Q99623|PHB2_HUMAN Prohibitin-2 OS=Homo sapiens OX=9606 GN=PHB2 PE=1 SV=2	0.09987530378402049	-0.026654125545629626	PHB2	0.981694388924554
sp|Q99627|CSN8_HUMAN COP9 signalosome complex subunit 8 OS=Homo sapiens OX=9606 GN=COPS8 PE=1 SV=1	0.027742424108755635	-0.022005118530003615	COPS8	0.9848629486993746
sp|Q99643|C560_HUMAN Succinate dehydrogenase cytochrome b560 subunit, mitochondrial OS=Homo sapiens OX=9606 GN=SDHC PE=1 SV=1	0.06675479586741268	0.015446478190259405	SDHC	1.0107642044408605
sp|Q99653|CHP1_HUMAN Calcineurin B homologous protein 1 OS=Homo sapiens OX=9606 GN=CHP1 PE=1 SV=3	0.2669265944943464	0.14188084759943714	CHP1	1.1033426110465252
sp|Q99661|KIF2C_HUMAN Kinesin-like protein KIF2C OS=Homo sapiens OX=9606 GN=KIF2C PE=1 SV=2	0.053265312259230424	-0.03133700687261115	KIF2C	0.9785130475870784
sp|Q99700|ATX2_HUMAN Ataxin-2 OS=Homo sapiens OX=9606 GN=ATXN2 PE=1 SV=2	0.40559042556112856	-0.26904370759607255	ATXN2	0.8298694436529465
sp|Q99714|HCD2_HUMAN 3-hydroxyacyl-CoA dehydrogenase type-2 OS=Homo sapiens OX=9606 GN=HSD17B10 PE=1 SV=3	0.3822185132651761	0.06734285797528727	HSD17B10	1.0477851047324158
sp|Q99715|COCA1_HUMAN Collagen alpha-1(XII) chain OS=Homo sapiens OX=9606 GN=COL12A1 PE=1 SV=2	3.424465173369889	-0.2922265878710399	COL12A1	0.8166407204714496
sp|Q99729|ROAA_HUMAN Heterogeneous nuclear ribonucleoprotein A/B OS=Homo sapiens OX=9606 GN=HNRNPAB PE=1 SV=2	0.016298104918958774	-0.0079532599758384	HNRNPAB	0.9945023877571861
sp|Q99732|LITAF_HUMAN Lipopolysaccharide-induced tumor necrosis factor-alpha factor OS=Homo sapiens OX=9606 GN=LITAF PE=1 SV=2	0.3841967224510703	0.0456634090891736	LITAF	1.0321576977316231
sp|Q99733|NP1L4_HUMAN Nucleosome assembly protein 1-like 4 OS=Homo sapiens OX=9606 GN=NAP1L4 PE=1 SV=1	0.7397043929448395	-0.16649985979893012	NAP1L4	0.8910017313287952
sp|Q99735|MGST2_HUMAN Microsomal glutathione S-transferase 2 OS=Homo sapiens OX=9606 GN=MGST2 PE=1 SV=1	0.0740080343674783	-0.010348857831889935	MGST2	0.9928523849486053
sp|Q99747|SNAG_HUMAN Gamma-soluble NSF attachment protein OS=Homo sapiens OX=9606 GN=NAPG PE=1 SV=1	0.8771377660867614	-0.37180441656360586	NAPG	0.7728153116558821
sp|Q99755|PI51A_HUMAN Phosphatidylinositol 4-phosphate 5-kinase type-1 alpha OS=Homo sapiens OX=9606 GN=PIP5K1A PE=1 SV=1	0.023132090154701142	0.013523658517110376	PIP5K1A	1.0094179582416822
sp|Q99757|THIOM_HUMAN Thioredoxin, mitochondrial OS=Homo sapiens OX=9606 GN=TXN2 PE=1 SV=2	0.8029180339275277	0.3017832372815267	TXN2	1.232667105206549
sp|Q99766|ATP5S_HUMAN ATP synthase subunit s, mitochondrial OS=Homo sapiens OX=9606 GN=DMAC2L PE=1 SV=3	0.6726598879853029	0.060238337942292275	DMAC2L	1.0426379938228456
sp|Q99797|MIPEP_HUMAN Mitochondrial intermediate peptidase OS=Homo sapiens OX=9606 GN=MIPEP PE=1 SV=2	0.21976505620225406	0.14748295786262755	MIPEP	1.1076353154015182
sp|Q99798|ACON_HUMAN Aconitate hydratase, mitochondrial OS=Homo sapiens OX=9606 GN=ACO2 PE=1 SV=2	0.28212735385415827	0.03164846441930402	ACO2	1.02217942999517
sp|Q99805|TM9S2_HUMAN Transmembrane 9 superfamily member 2 OS=Homo sapiens OX=9606 GN=TM9SF2 PE=1 SV=1	0.01760765968002284	0.009691984422331865	TM9SF2	1.006740587864698
sp|Q99808|S29A1_HUMAN Equilibrative nucleoside transporter 1 OS=Homo sapiens OX=9606 GN=SLC29A1 PE=1 SV=3	1.7942796892169945	-0.48252249295713157	SLC29A1	0.7157251134143064
sp|Q99816|TS101_HUMAN Tumor susceptibility gene 101 protein OS=Homo sapiens OX=9606 GN=TSG101 PE=1 SV=2	0.022396973641115647	0.02738545067447401	TSG101	1.019163454270926
sp|Q99829|CPNE1_HUMAN Copine-1 OS=Homo sapiens OX=9606 GN=CPNE1 PE=1 SV=1	1.416060219604314	-0.33834367604728965	CPNE1	0.7909488604198998
sp|Q99832|TCPH_HUMAN T-complex protein 1 subunit eta OS=Homo sapiens OX=9606 GN=CCT7 PE=1 SV=2	0.9106441400959646	-0.0867117043739487	CCT7	0.9416666202061108
sp|Q99848|EBP2_HUMAN Probable rRNA-processing protein EBP2 OS=Homo sapiens OX=9606 GN=EBNA1BP2 PE=1 SV=2	0.006955527767558875	-0.0018997319202882501	EBNA1BP2	0.9986840727682041
sp|Q99873|ANM1_HUMAN Protein arginine N-methyltransferase 1 OS=Homo sapiens OX=9606 GN=PRMT1 PE=1 SV=3	0.1802980866241766	-0.07144161620411404	PRMT1	0.9516865478701165
sp|Q99959|PKP2_HUMAN Plakophilin-2 OS=Homo sapiens OX=9606 GN=PKP2 PE=1 SV=2	0.1043088766803092	0.04448084267710117	PKP2	1.0313119923877787
sp|Q99961|SH3G1_HUMAN Endophilin-A2 OS=Homo sapiens OX=9606 GN=SH3GL1 PE=1 SV=1	0.8404067903818683	-0.3610943561747316	SH3GL1	0.7785737685569986
sp|Q99986|VRK1_HUMAN Serine/threonine-protein kinase VRK1 OS=Homo sapiens OX=9606 GN=VRK1 PE=1 SV=1	0.06777691361817574	0.02637738019484115	VRK1	1.0184515715048004
sp|Q9BPW8|NIPS1_HUMAN Protein NipSnap homolog 1 OS=Homo sapiens OX=9606 GN=NIPSNAP1 PE=1 SV=1	0.010213089914688996	-0.013819271611706513	NIPSNAP1	0.9904669413151359
sp|Q9BPX3|CND3_HUMAN Condensin complex subunit 3 OS=Homo sapiens OX=9606 GN=NCAPG PE=1 SV=1	0.627582836192228	-0.16724536941508217	NCAPG	0.8905414270063531
sp|Q9BPX5|ARP5L_HUMAN Actin-related protein 2/3 complex subunit 5-like protein OS=Homo sapiens OX=9606 GN=ARPC5L PE=1 SV=1	0.08627411427091797	-0.07322187029075367	ARPC5L	0.9505129117807272
sp|Q9BQ04|RBM4B_HUMAN RNA-binding protein 4B OS=Homo sapiens OX=9606 GN=RBM4B PE=1 SV=1	0.4693388070577862	-0.07309296264291176	RBM4B	0.9505978457788817
sp|Q9BQ39|DDX50_HUMAN ATP-dependent RNA helicase DDX50 OS=Homo sapiens OX=9606 GN=DDX50 PE=1 SV=1	0.18646567807161132	-0.057579679720669685	DDX50	0.9608747680994904
sp|Q9BQ48|RM34_HUMAN 39S ribosomal protein L34, mitochondrial OS=Homo sapiens OX=9606 GN=MRPL34 PE=1 SV=1	0.06793382559141425	0.026579339040895933	MRPL34	1.018594151672917
sp|Q9BQ52|RNZ2_HUMAN Zinc phosphodiesterase ELAC protein 2 OS=Homo sapiens OX=9606 GN=ELAC2 PE=1 SV=2	0.08499672145001029	0.04020476176966345	ELAC2	1.0282597572517536
sp|Q9BQ61|TRIR_HUMAN Telomerase RNA component interacting RNase OS=Homo sapiens OX=9606 GN=TRIR PE=1 SV=1	0.2933724105266778	-0.1720528948816749	TRIR	0.8875787945389482
sp|Q9BQ67|GRWD1_HUMAN Glutamate-rich WD repeat-containing protein 1 OS=Homo sapiens OX=9606 GN=GRWD1 PE=1 SV=1	0.3652041432650667	-0.15726220204058408	GRWD1	0.8967251698892619
sp|Q9BQ69|MACD1_HUMAN ADP-ribose glycohydrolase MACROD1 OS=Homo sapiens OX=9606 GN=MACROD1 PE=1 SV=2	0.9526544853245957	-0.18178695948638057	MACROD1	0.8816103343105997
sp|Q9BQ70|TCF25_HUMAN Transcription factor 25 OS=Homo sapiens OX=9606 GN=TCF25 PE=1 SV=1	0.9137261242019571	-0.3357746015966021	TCF25	0.7923585948199853
sp|Q9BQ75|CMS1_HUMAN Protein CMSS1 OS=Homo sapiens OX=9606 GN=CMSS1 PE=1 SV=2	0.29968949660834665	0.2152730784224789	CMSS1	1.1609236373222283
sp|Q9BQ95|ECSIT_HUMAN Evolutionarily conserved signaling intermediate in Toll pathway, mitochondrial OS=Homo sapiens OX=9606 GN=ECSIT PE=1 SV=1	0.10336222148325017	0.07501108121879152	ECSIT	1.0533691267630823
sp|Q9BQA1|MEP50_HUMAN Methylosome protein 50 OS=Homo sapiens OX=9606 GN=WDR77 PE=1 SV=1	0.15235685948234193	0.13595041586121584	WDR77	1.098816451588794
sp|Q9BQC6|RT63_HUMAN Ribosomal protein 63, mitochondrial OS=Homo sapiens OX=9606 GN=MRPL57 PE=1 SV=1	0.023525393700815123	0.01853557560919883	MRPL57	1.012930770609926
sp|Q9BQE3|TBA1C_HUMAN Tubulin alpha-1C chain OS=Homo sapiens OX=9606 GN=TUBA1C PE=1 SV=1	0.265438154374431	-0.03255783506275822	TUBA1C	0.9776853667676505
sp|Q9BQE5|APOL2_HUMAN Apolipoprotein L2 OS=Homo sapiens OX=9606 GN=APOL2 PE=1 SV=1	5.022822089049934	0.8563306771092396	APOL2	1.8104278425875506
sp|Q9BQG0|MBB1A_HUMAN Myb-binding protein 1A OS=Homo sapiens OX=9606 GN=MYBBP1A PE=1 SV=2	0.41885629718631245	0.047200448479819634	MYBBP1A	1.0332579388779728
sp|Q9BQI0|AIF1L_HUMAN Allograft inflammatory factor 1-like OS=Homo sapiens OX=9606 GN=AIF1L PE=1 SV=1	0.7135010327993705	-0.24301476885421808	AIF1L	0.8449777343399077
sp|Q9BQP7|MGME1_HUMAN Mitochondrial genome maintenance exonuclease 1 OS=Homo sapiens OX=9606 GN=MGME1 PE=1 SV=1	0.17094464274573706	0.09981178996271925	MGME1	1.071633651030484
sp|Q9BQS8|FYCO1_HUMAN FYVE and coiled-coil domain-containing protein 1 OS=Homo sapiens OX=9606 GN=FYCO1 PE=1 SV=3	0.045263004962721516	0.020872705625090582	FYCO1	1.0145730230620864
sp|Q9BR39|JPH2_HUMAN Junctophilin-2 OS=Homo sapiens OX=9606 GN=JPH2 PE=1 SV=2	0.15065111788415245	0.08868841144097783	JPH2	1.0634029777906076
sp|Q9BR76|COR1B_HUMAN Coronin-1B OS=Homo sapiens OX=9606 GN=CORO1B PE=1 SV=1	0.01604468331011743	0.007610040535543705	CORO1B	1.0052888148048198
sp|Q9BRA2|TXD17_HUMAN Thioredoxin domain-containing protein 17 OS=Homo sapiens OX=9606 GN=TXNDC17 PE=1 SV=1	0.07488974643801821	0.04861411865809584	TXNDC17	1.034270905427804
sp|Q9BRD0|BUD13_HUMAN BUD13 homolog OS=Homo sapiens OX=9606 GN=BUD13 PE=1 SV=1	0.004142710543659057	-0.006249984882547244	BUD13	0.9956772108666069
sp|Q9BRG1|VPS25_HUMAN Vacuolar protein-sorting-associated protein 25 OS=Homo sapiens OX=9606 GN=VPS25 PE=1 SV=1	0.5022768667652512	-0.1715144493219505	VPS25	0.8879101203161746
sp|Q9BRJ2|RM45_HUMAN 39S ribosomal protein L45, mitochondrial OS=Homo sapiens OX=9606 GN=MRPL45 PE=1 SV=2	1.444352588143604	0.4427190800876792	MRPL45	1.359163561379338
sp|Q9BRJ6|CG050_HUMAN Uncharacterized protein C7orf50 OS=Homo sapiens OX=9606 GN=C7orf50 PE=1 SV=1	0.042394274997240494	0.03277817624134505	C7orf50	1.0229801677782857
sp|Q9BRJ7|TIRR_HUMAN Tudor-interacting repair regulator protein OS=Homo sapiens OX=9606 GN=NUDT16L1 PE=1 SV=1	0.10235105708260157	-0.0580726051179882	NUDT16L1	0.9605465222412527
sp|Q9BRK3|MXRA8_HUMAN Matrix remodeling-associated protein 8 OS=Homo sapiens OX=9606 GN=MXRA8 PE=1 SV=1	0.34529068518125494	-0.14127680520768016	MXRA8	0.9067163435253293
sp|Q9BRK5|CAB45_HUMAN 45 kDa calcium-binding protein OS=Homo sapiens OX=9606 GN=SDF4 PE=1 SV=1	0.3184699003042945	0.10103765003807819	SDF4	1.0725446066683442
sp|Q9BRP8|PYM1_HUMAN Partner of Y14 and mago OS=Homo sapiens OX=9606 GN=PYM1 PE=1 SV=1	0.05854868028601279	-0.06037816571009405	PYM1	0.9590127056539889
sp|Q9BRQ6|MIC25_HUMAN MICOS complex subunit MIC25 OS=Homo sapiens OX=9606 GN=CHCHD6 PE=1 SV=1	0.5038422909939618	0.13290266205650364	CHCHD6	1.09649760592378
sp|Q9BRR6|ADPGK_HUMAN ADP-dependent glucokinase OS=Homo sapiens OX=9606 GN=ADPGK PE=1 SV=1	0.5600873389265091	0.26225009383697595	ADPGK	1.199347804917792
sp|Q9BRS2|RIOK1_HUMAN Serine/threonine-protein kinase RIO1 OS=Homo sapiens OX=9606 GN=RIOK1 PE=1 SV=2	0.13727476155927318	-0.06831167539994887	RIOK1	0.9537534823199209
sp|Q9BRT2|UQCC2_HUMAN Ubiquinol-cytochrome-c reductase complex assembly factor 2 OS=Homo sapiens OX=9606 GN=UQCC2 PE=1 SV=1	0.0978453674447428	0.06092808581584608	UQCC2	1.043136594885127
sp|Q9BRT6|LLPH_HUMAN Protein LLP homolog OS=Homo sapiens OX=9606 GN=LLPH PE=1 SV=1	4.13725175689686	-0.6171682033892559	LLPH	0.6519493526153706
sp|Q9BRX2|PELO_HUMAN Protein pelota homolog OS=Homo sapiens OX=9606 GN=PELO PE=1 SV=2	1.1673271054047234	-0.3477581344611832	PELO	0.7858042444624038
sp|Q9BRX5|PSF3_HUMAN DNA replication complex GINS protein PSF3 OS=Homo sapiens OX=9606 GN=GINS3 PE=1 SV=1	0.051166504799991235	-0.03684336966352292	GINS3	0.9747854555334459
sp|Q9BRX8|PXL2A_HUMAN Peroxiredoxin-like 2A OS=Homo sapiens OX=9606 GN=PRXL2A PE=1 SV=3	0.2375729373156429	0.12128514822428094	PRXL2A	1.0877033538386984
sp|Q9BRZ2|TRI56_HUMAN E3 ubiquitin-protein ligase TRIM56 OS=Homo sapiens OX=9606 GN=TRIM56 PE=1 SV=3	9.054533195288652	-2.8280514820394513	TRIM56	0.14082237827796346
sp|Q9BS26|ERP44_HUMAN Endoplasmic reticulum resident protein 44 OS=Homo sapiens OX=9606 GN=ERP44 PE=1 SV=1	0.9552490104729137	0.13425255007769343	ERP44	1.0975240471492989
